id,title,num,crn,section,hours,times,faculty,location,limit,enrolled,available,info,description,subj,subject,subj_code,cat_term,credit_hours
202620AFST16041,"African-American Literature",395,16041,A,4,"TR 1330-1445,  ","B Threatt",TBA,20,8,"Available: 12","Prerequisites: One course in English with attribute GFWI","A study of the major traditions of African-American writing from the nineteenth century to the present, including Frederick Douglass, Linda Brent, Zora Neale Hurston, Langston Hughes, Richard Wright, Ralph Ellison, Ernest Gaines, Toni Morrison, and Rita Dove.",ENGL,"African and African American Studies",INGS,202620,"4 hours"
202620AFST16070,"Tropical Forest Ecology and Management",212,16070,A,4,"MWF 1200-1250,  ","T Harris",TBA,26,26,"Closed // Waitlist: 5","General Education: G5: Observing-Experimenting-Modeling<br><br>Reserved Seats: new first-year students - 8 (none available)","An introduction to the ecology and management of forests and natural resources in the tropical biome. Social and technical aspects of forestry and natural resource management are considered. Topics include tropical forest ecology, techniques of forest and natural resource management, land tenure, the use of plants as pharmaceuticals, agroforestry, trees in traditional management systems, the forest as habitat, and the role of western environmental assistance in tropical countries.",FORS,"African and African American Studies",INGS,202620,"4 hours"
202620AFST15946,"African-American History since 1865",232,15946,A,4,"TR 1330-1445,  ","A Donaldson",TBA,26,24,"Available: 2 Reserved // Waitlist: 1","General Education: G4: Exploring Past and Present,G7: Encountering Perspectives<br><br>Reserved Seats: new first-year students - 10 (2 available)","A survey of the major topics and issues in African-American history from 1865 to the present: the era of emancipation, the turn-of-the-century nadir of race relations, black participation in both world wars, the Harlem Renaissance, the Civil Rights Movement, and various dimensions of contemporary black life. The course will also explore some of the historiographical themes that have catalyzed current scholarship and will analyze diverse theories about the black experience in America.",HIST,"African and African American Studies",INGS,202620,"4 hours"
202620AFST15952,"Black Power to Black Lives Matter",318,15952,A,4,"M 1400-1630,  ","A Donaldson",TBA,15,11,"Available: 4","Prerequisites: One course with attribute G4 including AP or IB credit","This American History course covers the Black Power Movement’s history from its origins in the late 1960s and early 1970s through the current Black Lives Matter era. Together we review how the Black Power Movement empowered individuals and groups to protest police brutality, advance criminal justice reform, advocate for self-defense, promote Black collective interests, advance Black values, create Black institutions, and secure Black autonomy.",HIST,"African and African American Studies",INGS,202620,"4 hours"
202620AFST16136,"Globalization and Culture in Africa",108,16136,A,4,"MWF 1200-1250,  ","E Asiedu-Acquah",TBA,26,26,"Closed // Waitlist: 0","General Education: G4: Exploring Past and Present<br><br>Reserved Seats: new first-year students - 10 (none available)","The course introduces students to the concepts of “culture” and “globalization” with an emphasis on exploring how cultural practices are shaped by border-crossing and other forms of cross-cultural exchange. Specifically, the context of Africa allows the examination of shared characteristics of globalization through colonization and other historical developments. The majority of the course then explores the cultural hybridity and heterogeneity that result from this process and continue to inform cultural practice in the contemporary period. Africa as a geographic region provides insight into the complexity of “globalization” outcomes that depend upon the diverse economic, social, cultural, and historical contexts in which cross-cultural exchange occurs.",INGS,"African and African American Studies",INGS,202620,"4 hours"
202620AFST16280,"American Voting Behavior",405,16280,A,4,"TR 1100-1215,  ","C Peterson",TBA,15,12,"Available: 3","General Education: GMWI: Major Writing Intensive","This course exposes students to essential theories on American voting behavior developed by leading political scientists. At the end of the course, students will be equipped to contribute competently to academic discussions on the topic.",POLS,"African and African American Studies",INGS,202620,"4 hours"
202620AFST16216,"Psychology of Human Diversity",280,16216,A,4,"TR 1100-1215,  ","L Mendez",TBA,26,26,"Closed // Waitlist: 4","General Education: G7: Encountering Perspectives<br><br>Open only to first-year students and sophomores; Reserved Seats: new first-year students - 13 (none available)","This course offers a psychological exploration of human diversity, with a primary focus on minority groups in the U.S. Students examine a wide range of psychological topics within a cultural context, including gender, age, sexual orientation, ethnicity, disability, social class, personality, intelligence, health, intergroup relations, and intercultural communication. The course also introduces cross-cultural research methods that enable diverse perspectives to shape psychological theory and practice. Students develop a nuanced appreciation of how diversity impacts various aspects of life, including research, service delivery, workplace dynamics, and personal relationships.",PSYC,"African and African American Studies",INGS,202620,"4 hours"
202620AFST16114,"Hip Hop Theatre",302,16114,A,4,"W 1400-1630,  ","D Cooper",TBA,15,15,"Closed // Waitlist: 0","General Education: G2: Understanding the Arts,G7: Encountering Perspectives","This course offers an opportunity for students to explore in depth a variety of specialized topics in theatre performance theory and techniques.  Advanced, new, or experimental techniques in performance will be emphasized in this course.",THTR,"African and African American Studies",INGS,202620,"4 hours"
202620AMST15874,"Junior Seminar",333,15874,A,4,"W 1400-1630,  ","S O'Rourke",TBA,12,7,"Available: 5",,"Reading and discussion of significant texts from various disciplines including important theoretical analyses of American cultural and intellectual life.",AMST,"American Studies",HIST,202620,"4 hours"
202620AMST16039,"American Literature from 1850-1900",378,16039,A,4,"TR 1100-1215,  ","J Grammer",TBA,20,20,"Closed // Waitlist: 0","Prerequisites: One course in English with attribute GFWI","Like Abraham Lincoln’s announcement of “a new birth of freedom” in the Gettysburg Address, the American literature covered in English 378 struggles to articulate, then problematize, American freedom in the era surrounding the Civil War and emancipation.  What is freedom?  To whom does it extend?  What are its blessings and its costs?  Nobody has ever thought more profoundly about these issues than the American writers who emerged before, during, and after the war America fought with itself:  Nathaniel Hawthorne, Herman Melville, Harriet Jacobs, Emily Dickinson, Mark Twain, Henry James, Charles Chesnutt, Charlotte Perkins Gilman, and others.",ENGL,"American Studies",HIST,202620,"4 hours"
202620AMST16040,Faulkner,393,16040,A,4,"M 1400-1630,  ","J Grammer",TBA,15,12,"Available: 3","General Education: GMWI: Major Writing Intensive<br><br>Prerequisites: One course in English with attribute GFWI","The most innovative American novelist of the twentieth century is also the writer we need to make sense of the twenty-first. “The past is never dead,” Faulkner said. “It isn’t even past.”  But why isn’t it?  Why can’t we, as so many Americans ask, “just move on”?  Faulkner’s novels keep asking this plaintive question, his characters yearning for the freedom of the fresh start but caught by a tragic past that doesn’t want to let go.  This class focuses on the major novels Faulkner wrote, in blindingly quick succession, between 1929 and 1942, what he later called his “matchless time.”",ENGL,"American Studies",HIST,202620,"4 hours"
202620AMST16041,"African-American Literature",395,16041,A,4,"TR 1330-1445,  ","B Threatt",TBA,20,8,"Available: 12","Prerequisites: One course in English with attribute GFWI","A study of the major traditions of African-American writing from the nineteenth century to the present, including Frederick Douglass, Linda Brent, Zora Neale Hurston, Langston Hughes, Richard Wright, Ralph Ellison, Ernest Gaines, Toni Morrison, and Rita Dove.",ENGL,"American Studies",HIST,202620,"4 hours"
202620AMST15943,"History of the United States II",202,15943,A,4,"TR 1100-1215,  ","A Donaldson",TBA,26,26,"Closed // Waitlist: 2","General Education: G4: Exploring Past and Present<br><br>Reserved Seats: new first-year students - 10 (none available)","A general survey of the political, constitutional, economic, and social history of the United States.",HIST,"American Studies",HIST,202620,"4 hours"
202620AMST15946,"African-American History since 1865",232,15946,A,4,"TR 1330-1445,  ","A Donaldson",TBA,26,24,"Available: 2 Reserved // Waitlist: 1","General Education: G4: Exploring Past and Present,G7: Encountering Perspectives<br><br>Reserved Seats: new first-year students - 10 (2 available)","A survey of the major topics and issues in African-American history from 1865 to the present: the era of emancipation, the turn-of-the-century nadir of race relations, black participation in both world wars, the Harlem Renaissance, the Civil Rights Movement, and various dimensions of contemporary black life. The course will also explore some of the historiographical themes that have catalyzed current scholarship and will analyze diverse theories about the black experience in America.",HIST,"American Studies",HIST,202620,"4 hours"
202620AMST15960,"Colonial and Imperial Warfare in North America and Southern Africa",324,15960,A,4,"W 1400-1630,  ","R Levine",TBA,15,12,"Available: 3","Prerequisites: One course with attribute G4 including AP or IB credit","This seminar compares the warfare that accompanied colonial encounters in North America and southern Africa, from the first European contact through the early twentieth century.  It focuses on wars fought in response to resistance by native peoples and on the use of native allies in warfare between imperial foes as windows into the processes of acculturation, resistance, dispossession, and representation that characterized the colonial encounter as a whole.  Texts range from traditional military history to religious, cultural, environmental, and comparative approaches to the topic.",HIST,"American Studies",HIST,202620,"4 hours"
202620AMST16255,"The American Congress",204,16255,A,4,"TR 1330-1445,  ","E Riley",TBA,26,26,"Closed // Waitlist: 4",,"A study of the institution and processes of the American Congress, including its design and development over time. This course studies Congress by 3 approaches—Congress and its constituents, Congress and its members, Congress and the American political system—with special attention to its representation and law-making functions.",POLS,"American Studies",HIST,202620,"4 hours"
202620AMST16250,"Introduction to Public Policy",223,16250,A,4,"MW 1530-1645,  ","P Gauding",TBA,26,26,"Closed // Waitlist: 0","General Education: G4: Exploring Past and Present<br><br>Reserved Seats: new first-year students - 6 (none available)","Students are introduced to foundational theories of public policy, gaining valuable insight into ""who gets what, when, and how"" in the political process. Through a series of case studies in environmental, social welfare, criminal justice, and health policy, students are asked to apply and critically evaluate policy problems and solutions, given existing public policy theories.",POLS,"American Studies",HIST,202620,"4 hours"
202620AMST16277,"Environmental Politics and Policy",313,16277,A,4,"MW 1400-1515,  ","P Gauding",TBA,20,17,"Available: 3","Not open to new first-year students; Prerequisite:  POLS 101  or  POLS 223  ","The course explores the ideas that influence environmental thought, examines various environmental problems and suggested solutions, and critically evaluates the role that political institutions play in creating and enforcing environmental policy. Specific topics include environmental justice, environmental federalism, environmental health, and regulatory behavior. Not open for credit to students who have completed ENST 334.",POLS,"American Studies",HIST,202620,"4 hours"
202620AMST16094,"Rediscovering America, Reconsidering Religion",119,16094,A,4,"MWF 1000-1050,  ","K Curts",TBA,26,26,"Closed // Waitlist: 7","General Education: G3: Seeking Meaning,G7: Encountering Perspectives<br><br>Reserved Seats: new first-year students - 10 (none available)","An introduction to and critical interrogation of what counts as ""America"" and ""religion."" It asks how these terms have been defined and debated and to what effect. This course examines select moments, figures, debates, and movements from colonial encounter to the present that have helped form and reshape these concepts (religion, America/n), particularly as they intersect with other categories of human distinction and difference-making, including race, space, gender, sex, and class.",RELG,"American Studies",HIST,202620,"4 hours"
202620AMST16095,"Rediscovering America, Reconsidering Religion",119,16095,B,4,"MWF 1200-1250,  ","K Curts",TBA,26,26,"Closed // Waitlist: 3","General Education: G3: Seeking Meaning,G7: Encountering Perspectives<br><br>Reserved Seats: new first-year students - 10 (none available)","An introduction to and critical interrogation of what counts as ""America"" and ""religion."" It asks how these terms have been defined and debated and to what effect. This course examines select moments, figures, debates, and movements from colonial encounter to the present that have helped form and reshape these concepts (religion, America/n), particularly as they intersect with other categories of human distinction and difference-making, including race, space, gender, sex, and class.",RELG,"American Studies",HIST,202620,"4 hours"
202620ANTH16235,"Introductory Cultural Anthropology",104,16235,A,4,"MWF 1200-1250,  ","Y Kang",TBA,26,26,"Closed // Waitlist: 7","General Education: G4: Exploring Past and Present,G7: Encountering Perspectives<br><br>Reserved Seats: new first-year students - 13 (none available)","Introducing perspectives of Socio-Cultural Anthropology, the class explores how culture (the way of life shared by a group of people) creates varied realities and life experiences worldwide in relation to socially-generated understandings of gender, religion, ethnicity, class, race, and kinship. Focused on patterns of difference and similarity across cultures around the globe, this course teaches students the value of cross-cultural comparison and how to analyze their own cultural backgrounds through the anthropological lens.",ANTH,Anthropology,ANTH,202620,"4 hours"
202620ANTH16236,"Introductory Cultural Anthropology",104,16236,B,4,"MWF 1300-1350,  ","Y Kang",TBA,26,26,"Closed // Waitlist: 1","General Education: G4: Exploring Past and Present,G7: Encountering Perspectives<br><br>Reserved Seats: new first-year students - 13 (none available)","Introducing perspectives of Socio-Cultural Anthropology, the class explores how culture (the way of life shared by a group of people) creates varied realities and life experiences worldwide in relation to socially-generated understandings of gender, religion, ethnicity, class, race, and kinship. Focused on patterns of difference and similarity across cultures around the globe, this course teaches students the value of cross-cultural comparison and how to analyze their own cultural backgrounds through the anthropological lens.",ANTH,Anthropology,ANTH,202620,"4 hours"
202620ANTH16238,"Mountains, Monuments, and Mummies: Archaeology in Andean South America",230,16238,A,4,"MWF 1100-1150,  ","E Sharp",TBA,26,26,"Closed // Waitlist: 5","General Education: G4: Exploring Past and Present<br><br>Reserved Seats: new first-year students - 8 (none available)","The landscape of the Central Andes is one of environmental extremes, from the Andes mountains to coastal deserts and the Amazon rainforest. This course covers the cultures that adapted to this diverse landscape and thrived in this tropical region of South America for millennia. Class topics include the Inka Empire, once the largest Indigenous empire in the Americas, the Nazca lines, and the Chinchorro culture, renowned for creating the world’s oldest mummies. The course also discusses a variety of other pre-Inka societies and examines the role of archaeology in reconstructing the region’s history.",ANTH,Anthropology,ANTH,202620,"4 hours"
202620ANTH16237,"Artificial Intelligence as Cultural Technology",240,16237,A,4,"TR 0930-1045,  ","B McCray",TBA,26,26,"Closed // Waitlist: 1","For a detailed description of this Special Topics Course: <a href=""https://registrar.sewanee.edu/students/topics/""> https://registrar.sewanee.edu/students/topics</a>","Though content varies from semester to semester, this intermediate class focuses on a special topic in Anthropology not fully covered in existing courses. This course may be repeated for credit when the topic differs.",ANTH,Anthropology,ANTH,202620,"4 hours"
202620ANTH16240,"Human Skeletal Analysis in Bioarchaeology and Forensic Anthropology",284,16240,A,4,"MWF 0900-0950,  ","E Sharp",TBA,18,18,"Closed // Waitlist: 4",,"This course examines the human body as an archive of lived experience and life history through the fields of bioarchaeology and forensic anthropology. The course begins with an introduction to human osteology and bone biology and then discusses methods related to reconstructing biological profiles—age at death, sex, stature, population affinity—and identifying skeletal trauma. Theoretical approaches to studying health and disease in the past are also covered, as well as ethical debates surrounding the analysis, curation, and repatriation of human remains.",ANTH,Anthropology,ANTH,202620,"4 hours"
202620ANTH16241,"Anthropology and Environmental Justice",285,16241,A,4,"MW 1930-2045,  ","R Tate",TBA,26,23,"Available: 3","General Education: G7: Encountering Perspectives<br><br>Reserved Seats: new first-year students - 8 (2 available)","This course considers the ways in which ethnicity, race, religion, gender, class and culture shape differential access to natural resources and a healthy living environment. Drawing on anthropological studies of local ecological knowledge, political economies and city and regional planning, the class asks how disproportionate experiences of environmental benefits and burdens can be redressed in societies around the globe. Students consider culturally-informed routes to food and water security and socioecological resilience in the wake of climate change.",ANTH,Anthropology,ANTH,202620,"4 hours"
202620ANTH16244,"Ecological Anthropology",298,16244,A,4,"TR 1100-1215,  ","C Ray",TBA,26,26,"Closed // Waitlist: 4","General Education: G4: Exploring Past and Present<br><br>Reserved Seats: new first-year students - 8 (none available)","This course will examine human-environmental relationships from the anthropological perspective. Consideration of theoretical approaches and practical applications will be supplemented by archaeological, ethnographical, and ethnohistorical case studies. We will consider various ecosystems and landscapes as palimpsests that reveal cultural footprints to the archaeologist and human choices to the ethnographer. We will explore how an understanding of both can greatly inform ecological studies and further new thinking about environmental policy.",ANTH,Anthropology,ANTH,202620,"4 hours"
202620ANTH16306,"One Health",320,16306,A,4,"T 1930-2200,  ","C Ray",TBA,18,17,"Available: 1",,"The unifying biocultural approach known as One Health examines interconnections between the health of humans, animals and the environment at local, regional and global scales. Students learn how anthropologists employ One Health in international studies of biocultural diversity
where ecosystems influence spiritual beliefs, identities and social and subsistence practices, and where these beliefs and practices help maintain ecosystems, and particular flora, fauna and soils. Through research projects and fieldwork, students consider how One-Health efforts to balance and optimize the health of animals, humans and the environment, also articulate with Anthropological approaches to Environmental and Social Justice.",ANTH,Anthropology,ANTH,202620,"4 hours"
202620ANTH16242,"Indigenous Plant Use: A Global Approach",325,16242,A,4,"MW 1400-1515,  ","R Tate",TBA,18,18,"Closed // Waitlist: 1","General Education: G7: Encountering Perspectives<br><br>Reserved Seats: new first-year students - 8 (none available)","This is a dynamic course in plant-human interaction that bridges cultural anthropology and related disciplines like economic botany, archaeology, and environmental history to explore a selection of economic plants that have shaped human society. This course follows case studies of select taxa to explore their origins and past uses, impacts of colonial encounters, effects of climate change, and other contemporary social and political entanglements. Special attention will be given to issues of plant use and Indigenous resilience, sovereignty, and cultural revitalization, as well as potential contributions to sustainable futures and agrobiodiversity.",ANTH,Anthropology,ANTH,202620,"4 hours"
202620ANTH16243,"Anthropological Theory",403,16243,A,4,"T 1330-1600,  ","Y Kang",TBA,15,8,"Available: 7","General Education: GMWI: Major Writing Intensive<br><br>Open only to juniors or seniors pursuing programs in anthropology","The historical development of anthropological theory beginning with positivism and classical evolutionary thinking through that of the neo-evolutionists. Consideration of different historical approaches is followed by exploration of cultural materialism, structuralism, Marxism, symbolic interpretation, and practice theory. The course concludes with a survey of post-modernism and collaborative approaches.",ANTH,Anthropology,ANTH,202620,"4 hours"
202620ART15880,"Introduction to Lens and Time-based Media",103,15880,A,4,"T 1330-1630,  ","P Malde",TBA,14,14,"Closed // Waitlist: 3","General Education: G2: Understanding the Arts<br><br>Open only to first-year students and sophomores; Reserved Seats: new first-year students - 7 (none available); Studio Art Fee-Malde: $450","An introduction to processes dependent on the lens as an imaging device, including wet-lab photography, digital photography, video editing and installation-based sequencing. The course incorporates the fundamental theoretical, technical and aesthetic principles of working with photography as an expressive medium. Assignments include darkroom laboratory work, studio projects, discussions, written analyses, and class presentations.",ART,Art,ART,202620,"4 hours"
202620ART16311,"Introduction to Three- and Four-Dimensional Media",104,16311,A,4,"T 1330-1630,  ","G Pond",TBA,15,11,"Available: 4","General Education: G2: Understanding the Arts<br><br>Open only to first-year students and sophomores; Studio Art Fee-Pond: $275","An introduction to sculptural media involving spatial and temporal dimensions, including sculpture, installation, computer-aided design, and Computer Numerical Control (CNC) fabrication. The course incorporates the fundamental theoretical, technical and aesthetic principles of composition in space and time. Assignments involve design of the production of objects; computer modeling; traditional and non-traditional sculpture techniques.",ART,Art,ART,202620,"4 hours"
202620ART15877,"Introduction to Drawing and Two-Dimensional Media",105,15877,A,4,"T 1330-1630,  ","J Wohl",TBA,15,15,"Closed // Waitlist: 10","General Education: G2: Understanding the Arts<br><br>Open only to first-year students and sophomores; Reserved Seats: new first-year students - 7 (none available); Studio Art Fee-Wohl: $125","An introduction to two-dimensional media that explores mark making as the basis for visualization and ideation. The course incorporates the fundamental theoretical, technical and aesthetic principles of composition in two-dimensions. Students use wet and dry media to solve problems and investigate concepts of representation, abstraction and expression using traditional and non-traditional techniques.",ART,Art,ART,202620,"4 hours"
202620ART15881,"The Lens, Time and Space:  Topics in Photography",261,15881,A,4,"R 1330-1630,  ","P Malde",TBA,4,4,"Closed // Waitlist: 1","Prerequisite:  ART 103  or  ART 263  ; Studio Art Fee-Malde: $450","This course introduces students to thematic approaches in photography using film-based methods, digital printing, and multi-media. Class projects and discussions center around the cultural and socio-political impact of the medium, as well the deeply personal and expressive aspects of photographic art.",ART,Art,ART,202620,"4 hours"
202620ART15882,"Intermediate Documentary Projects in Photography",263,15882,A,4,"TR 1100-1215,  ","P Malde",TBA,6,12,"Closed // Waitlist: 7","General Education: G2: Understanding the Arts<br><br>Community Engagement; Reserved Seats: new first-year students - 3 (none available); Studio Art Fee-Malde: $350","The course introduces students to documentary methods and issues pertaining to photography and related media used in the making of photo-documentaries.  Class projects and discussions examine the cultural and socio-political impact of this genre, as well as the genre's core triangulation points of subjectivity, objectivity, and truth.",ART,Art,ART,202620,"4 hours"
