id,title,num,crn,section,hours,times,faculty,location,limit,enrolled,available,info,description,subj,subject,subj_code,cat_term,credit_hours
202620HIST15959,"Crisis and Catastrophe in Early Modernity",314,15959,A,4,"MWF 1300-1350,  ","K Whitmer",TBA,15,15,"Closed // Waitlist: 0","Prerequisites: One course in history with attribute G4 including AP or IB credit","From sudden events such as the Lisbon earthquake of 1755, to those that unfolded over many years, crises and catastrophes were omnipresent in early modernity. While contemporaries often agreed that crises were imminent or unfolding, like today they did not always agree on how to respond. This course considers specific public health crises of the period, such as the global spread of smallpox and plague, positioning these within key readings in the history of science, medicine, capitalism and empire. Students also will study the disruptive dimensions of the period’s political and ecological crises and links between experiencing crisis and activism.",HIST,History,HIST,202620,"4 hours"
202620HIST15952,"Black Power to Black Lives Matter",318,15952,A,4,"M 1400-1630,  ","A Donaldson",TBA,15,11,"Available: 4","Prerequisites: One course with attribute G4 including AP or IB credit","This American History course covers the Black Power Movement’s history from its origins in the late 1960s and early 1970s through the current Black Lives Matter era. Together we review how the Black Power Movement empowered individuals and groups to protest police brutality, advance criminal justice reform, advocate for self-defense, promote Black collective interests, advance Black values, create Black institutions, and secure Black autonomy.",HIST,History,HIST,202620,"4 hours"
202620HIST15960,"Colonial and Imperial Warfare in North America and Southern Africa",324,15960,A,4,"W 1400-1630,  ","R Levine",TBA,15,12,"Available: 3","Prerequisites: One course with attribute G4 including AP or IB credit","This seminar compares the warfare that accompanied colonial encounters in North America and southern Africa, from the first European contact through the early twentieth century.  It focuses on wars fought in response to resistance by native peoples and on the use of native allies in warfare between imperial foes as windows into the processes of acculturation, resistance, dispossession, and representation that characterized the colonial encounter as a whole.  Texts range from traditional military history to religious, cultural, environmental, and comparative approaches to the topic.",HIST,History,HIST,202620,"4 hours"
202620HIST15953,"Religious Nationalism in the Contemporary World",338,15953,A,4,"T 1330-1600,  ","N Roberts",TBA,15,15,"Closed // Waitlist: 0","Prerequisites: One course with attribute G4 including AP or IB credit","Religious nationalist parties and social movements play an increasingly important role in our contemporary world. Promising a more “authentic” approach to nationalism than secular nationalism, these movements provide meaning to millions of adherents, while also contributing to partisanship and conflict around the world. This class investigates the history of religious nationalism with a focus primarily on the history of Christian, Muslim, and Jewish nationalism in the 20th and 21st centuries. Case studies will be drawn from the history of Israel/Palestine, India/Pakistan, Ireland, and the United States.",HIST,History,HIST,202620,"4 hours"
202620HIST15954,"Public History of Southern Appalachia",343,15954,A,4,"T 1330-1600,  ","T Momon",TBA,15,15,"Closed // Waitlist: 4","Prerequisites: One course in history with attribute G4 including AP or IB credit","Public historians work with a variety of people and non-academic institutions, including community heritage groups, historical societies, and museums. In this course, students will explore the practice of conducting historical research in support of projects proposed by these institutions. This course will blend theory and experience by examining the cultural, intellectual, and economic implications of conducting public history research while exploring the practical aspects of conducting public history fieldwork.",HIST,History,HIST,202620,"4 hours"
202620HIST15955,"Medieval England II",366,15955,A,4,"MW 1400-1515,  ","S Ridyard",TBA,16,15,"Available: 1","Prerequisites: One course with attribute G4 including AP or IB credit","Selected topics in the history of England from the Roman conquest to the accession of Henry Tudor. Emphasis on reading, papers, discussion.",HIST,History,HIST,202620,"4 hours"
202620HIST15956,"Sexuality and the Self in Modern Europe",378,15956,A,4,"TR 1500-1615,  ","A Mansker",TBA,15,15,"Closed // Waitlist: 0","Prerequisites: One course with attribute G4 including AP or IB credit","This seminar investigates how and why sexuality became the key to selfhood in modern Europe.  Drawing on the tools of gender analysis and cultural history, students explore the ways in which political, socioeconomic and cultural tensions of particular historical moments were manifested in the sexuality of individuals.  Students also examine a variety of primary sources from the eighteenth to twentieth centuries to consider how individuals defined themselves through sexuality and how definitions were imposed on them by a variety of institutions and authority figures.",HIST,History,HIST,202620,"4 hours"
202620HIST15957,"Capitalism in Britain and the United States",403,15957,A,4,"TR 0800-0915,  ","M Mitchell",TBA,15,13,"Available: 2","Prerequisites: One course with attribute G4 including AP or IB credit","The impulse to combine land, labor, and capital in profitable ways has always existed; this course focuses on how British and American entrepreneurs have attempted this challenge over the past 500 years of history. The differing cultural, institutional, and technological developments faced by entrepreneurs in each country are considered.",HIST,History,HIST,202620,"4 hours"
202620HIST15961,"The History of Sustainability and Sustainable Development",421,15961,A,4,"TR 1100-1215,  ","R Levine",TBA,15,14,"Available: 1","Prerequisites: One course with attribute G4 including AP or IB credit","An examination of the historical origins and development of the discourses of sustainability, sustainable development, and the green economy, which have been ubiquitous, influential, and critically and historiographically under-examined in contemporary U.S. and global society. The course draws on contemporary global environmental historiography, while analyzing key primary sources such as Malthus' <em>An Essay on the Principles of Population</em>, Marsh's <em>Man and Nature</em>, Ehrlich's <em>Population Bomb</em>, Club of Rome's <em>Limits to Growth</em>, the United Nations' Brundtland Commission's ""Our Common Future,"" the United Nations' Millennium Development Goals, and the University of the South's Sustainability Master Plan.",HIST,History,HIST,202620,"4 hours"
202620HUMN16133,"Experience, Expression, and Exchange: Texts and Contexts of the Modern World",106,16133,A,4,"MWF 1200-1250,  ","D Ettensohn",TBA,15,15,"Closed // Waitlist: 3","General Education: G1: Reading Closely,G2: Understanding the Arts,GFWI: Foundational Writing Intensive<br><br>Reserved Seats: new first-year students - 7 (none available)","As a critical introduction to cultural contexts and ideological tensions in the modern world, this interdisciplinary course examines the intersections of literature, the arts, philosophy, and politics to investigate what it means to be modern and how the modern era has reshaped and redefined the human experience. The course will compare literary, visual, and aural texts from different global traditions to de-link the concept of the modern from “the West” in its investigation of how societies have negotiated, registered, and expressed the experience of modernity.",HUMN,Humanities,HUMN,202620,"4 hours"
202620HUMN16134,"Italian Futurism and the Aesthetics of Modernity",206,16134,A,4,"MW 1400-1515,  ","A Martini",TBA,20,15,"Available: 5","General Education: G2: Understanding the Arts,G6IT: Comprehending Cross-Culturally (Italian Culture)<br><br>Reserved Seats: new first-year students - 3 (1 available)","This course explores Futurism, an avant-garde movement that developed in Italy in the early twentieth century. The course covers examples from multiple mediums (painting, sculpture, literature, architecture, urban design, dance, fashion, music, and cooking) to study how Futurism proposed to fashion a way of life and not solely an artistic idiom. Analyzing the numerous Futurist manifestos, this course investigates the movement’s programmatic approach to art and its position in the general artistic ferment that characterized Europe at the beginning of the twentieth century.",HUMN,Humanities,HUMN,202620,"4 hours"
202620INGS16283,"Japanese Print Culture",311,16283,A,4,"MWF 1100-1150,  ","A Miller",TBA,18,18,"Closed // Waitlist: 0",,"Explores the breadth of Japanese print culture, focusing on eighteenth to twentieth century artworks. Examines prints in light of economic and socio-cultural contexts, with special emphasis on topics such as the masculine culture of eighteenth century urban Japan, and globalization in the late nineteenth and early twentieth centuries. Genres covered include: early modern landscapes, “beautiful women” and actor prints, nineteenth-century political prints, and twentieth-century creative and revival prints from wartime and postwar Japan. Incorporates the study of museum print collections.",ARTH,"International & Global Studies",SPAN,202620,"4 hours"
202620INGS16034,"To Delight and to Move: The Global Baroque, 1600-1800",327,16034,A,4,"TR 1100-1215,  ","L Todd",TBA,18,17,"Available: 1",,"This course explores the early modern art movement known as “Baroque.” It begins with an historiographical examination of the term “baroque” and considers how and why the baroque visual language of <em>delectare et movere</em> appears across the globe from Europe to Asia and Latin America. (Of note: “global” in this sense would be excluding Africa.) The course examines and compares key works of painting, sculpture, architecture, and the decorative arts in consideration of their motivations and meanings. We conclude with an examination of the extension of baroque forms and styles in contemporary art in what has been referred to as the “Neobaroque” and “Ultrabaroque.”",ARTH,"International & Global Studies",SPAN,202620,"4 hours"
202620INGS15962,"The Comic and Sublime: An Introduction to Chinese Theater",241,15962,A,4,"MW 1400-1515,  ","Y Tan",TBA,26,9,"Available: 17","General Education: G6CH: Comprehending Cross-Culturally (Chinese Culture)","This course surveys the rich and varied traditions of Chinese theater from their origins in ritual and spectacle to their current formulations in traditional and modern productions. We will discuss both dramatic texts and theatrical performances. All readings will be in English. Course will be taught in English.",ASIA,"International & Global Studies",SPAN,202620,"4 hours"
202620INGS16010,"Environmental Economics",335,16010,A,4,"MWF 0800-0850,  ","A Elrod",TBA,20,20,"Closed // Waitlist: 5","Prerequisites: ECON 101 or ECON 120","A study of the causes of and solutions for pollution and environmental degradation weighs the value of ecosystems and their role in sustaining economic activity. Applies cost/benefit analysis to environmental issues and provides an introduction to economics of nonrenewable and renewable resources such as mines, forests, and fish.",ECON,"International & Global Studies",SPAN,202620,"4 hours"
202620INGS16011,"International Finance",344,16011,A,4,"TR 0800-0915,  ","K Theyson",TBA,20,6,"Available: 14","Prerequisite:  ECON 202 ","This courses studies financial aspects of growth, income and price level determination in open economies. Topics include the balance of payments, exchange rate determination, international payment adjustment mechanisms, capital flows, and international macroeconomic policy.",ECON,"International & Global Studies",SPAN,202620,"4 hours"
202620INGS16023,"The Novel in the Global Age",316,16023,A,4,"MWF 1000-1050,  ","D Ettensohn",TBA,15,15,"Closed // Waitlist: 1","General Education: GMWI: Major Writing Intensive<br><br>Prerequisites: One course in English with attribute GFWI","This course explores the contemporary Anglophone novel since 1989, a period that coincides with the increased pace of globalization. Written largely from transnational perspectives that defy traditional national boundaries, the novels in this course share a common concern with capturing global experience and analyzing the cultural and economic impact of globalization. Potential readings include works by Chimamanda Ngozi Adichie, Teju Cole, Amitav Ghosh, Michael Ondaatje, and Ruth Ozeki.",ENGL,"International & Global Studies",SPAN,202620,"4 hours"
202620INGS16044,"Foundations of Food and Agriculture",201,16044,A,4,"M 1400-1630,  ","D Carter",TBA,18,18,"Closed // Waitlist: 8","General Education: G4: Exploring Past and Present<br><br>Reserved Seats: new first-year students - 6 (none available)","Integrating local, regional, and global perspectives, this course outlines the history of agriculture, introduces the development of food systems and policy, and reviews the environmental impact of food production.  Among topics addressed are the history of agricultural expansion in the US, the development of agriculture and food policies, interaction among agricultural markets at home as well as abroad, and sustainable agriculture.  Classroom activities emphasize the involvement of multiple constituencies in identifying and articulating agricultural issues.  Field opportunities include garden activities and local trips aimed at relating broader issues to how livelihoods are pursued on the Cumberland Plateau.",ENST,"International & Global Studies",SPAN,202620,"4 hours"
202620INGS16049,"Freshwater Conservation",235,16049,A,4,"M 1330-1630,  ","K Cecala",TBA,16,16,"Closed // Waitlist: 13","Prerequisite:  BIOL 130  or  ENST 101  or  FORS 121  ","A survey of existing and emerging threats to wetland ecosystems and the consequences for animal and human populations. This course discusses causes, consequences, and solutions for issues of international and local concern based on an understanding of freshwater ecology and function. Also considers multiple perspectives on water use and attempts to reconcile these differences so as to identify and publicize potential conservation solutions.",ENST,"International & Global Studies",SPAN,202620,"4 hours"
202620INGS16052,"Environmental Policy and Law",334,16052,A,4,"TR 0800-0915,  ","D Carter",TBA,18,17,"Available: 1","Prerequisite:  ENST 101  or  ENST 200  and  POLS 101  ","This course combines the study of public policy with the study of major environmental problems. Students will explore public policy concepts and the instruments used in environmental regulation. Topics will include air and water quality issues hazardous waste and risk management, natural resources and biological diversity. The course will also discuss the impact of environmental groups and citizen activism on this highly complex area of public policy. Not open for credit to students who have completed POLS 208 or POLS 313.",ENST,"International & Global Studies",SPAN,202620,"4 hours"
202620INGS15927,"Discovering Paris",301,15927,A,4,"TR 0800-0915,  ","D Rung",TBA,20,20,"Closed // Waitlist: 6","General Education: G4: Exploring Past and Present,G6FR: Comprehending Cross-Culturally (French Culture)<br><br>Reserved Seats: new first-year students - 5 (none available); Prerequisite:  FREN 203 ","An interdisciplinary survey of Paris seen through history, culture, literature, and the arts. This course traces the development of Paris from its foundation by Gaulish boatmen of the Parisii tribe to its current status as a global city. Cinema, art, literature, and computer-mediated virtual tours are used to analyze the evolution of major political and cultural events in Parisian history. Taught in English. Does not count toward a French and French Studies major nor minor.",FREN,"International & Global Studies",SPAN,202620,"4 hours"
202620INGS15929,"Introduction to Literature, Culture, and History of the French-Speaking World",390,15929,A,4,"MW 1400-1515,  ","K Mills",TBA,20,14,"Available: 6","General Education: G1: Reading Closely,G6: Comprehending Cross-Culturally (Language)<br><br>Prerequisites: FREN 300 or placement","Readings in representative authors, themes and periods from France and from other Francophone countries.",FREN,"International & Global Studies",SPAN,202620,"4 hours"
202620INGS15930,"The History of French Cinema",415,15930,A,4,"TR 1100-1215,  ","A Glacet",TBA,16,16,"Closed // Waitlist: 1","Prerequisites: FREN 390 or placement","A survey of French films from the invention of cinema to the contemporary period, with an emphasis on points of connection with American cinema. From the Lumieres brothers to Melies, from Pathe and Gaumont to Surrealism (Clair, Bunuel, Cocteau), from Abel Gance to realism (Renoir, Carne) and from ""New Wave"" (Resnais, Godard, Truffaut) to ""Modern Cinema"" (Lelouch, Malle).",FREN,"International & Global Studies",SPAN,202620,"4 hours"
202620INGS15944,"History of Britain and Ireland II",206,15944,A,4,"MWF 0800-0850,  ","M Mitchell",TBA,26,26,"Closed // Waitlist: 3","General Education: G4: Exploring Past and Present<br><br>Reserved Seats: new first-year students - 10 (none available)","A general survey of the political, constitutional, economic, and social history of Britain, Ireland, and the British Empire from the Revolution of 1688 to the present.",HIST,"International & Global Studies",SPAN,202620,"4 hours"
202620INGS15945,"Latin American History Since 1826",224,15945,A,4,"TR 1500-1615,  ","C McEvoy",TBA,26,24,"Available: 2",,"A study of nation building and strongman government in the nineteenth century, the Mexican Revolution 1910-20, Argentina under Peron, and twentieth-century Brazil. Special emphasis on the roles of women and blacks.",HIST,"International & Global Studies",SPAN,202620,"4 hours"
202620INGS15947,"Early Modern Germany: Reformation to Revolutions",267,15947,A,4,"MWF 1100-1150,  ","K Whitmer",TBA,26,25,"Available: 1 Reserved // Waitlist: 5","General Education: G4: Exploring Past and Present,G6GM: Comprehending Cross-Culturally (German Culture)<br><br>Reserved Seats: new first-year students - 10 (1 available)","An introduction to the history of German-speaking Europe, c. 1450 to 1850. The course examines the complex history of the Holy Roman Empire, a vast, economically and culturally rich, multi-ethnic state. It also focuses on imperial politics in theory and practice, territorial expansion and diplomacy, the relative autonomy of many German cities, the Protestant Reformation and its aftermath, peasant revolts, the Thirty Years War, the German Enlightenment, and the Vormärz period that culminated in the 1848 Revolutions.",HIST,"International & Global Studies",SPAN,202620,"4 hours"
202620INGS15948,"France Since 1815",272,15948,A,4,"MW 1530-1645,  ","A Mansker",TBA,26,25,"Available: 1 Reserved // Waitlist: 5","General Education: G4: Exploring Past and Present,G6FR: Comprehending Cross-Culturally (French Culture)<br><br>Reserved Seats: new first-year students - 10 (1 available)","Although modern France is a product of the same tumultuous nineteenth- and twentieth-century developments experienced by the rest of Europe, the French reacted to the processes of industrialization, urbanization, and the democratization of politics, and the two world wars in their own fashion.  This course considers in detail how France became ""modern"" and what the effects of this process were on different groups of individuals in French society.  Readings center on primary documents.",HIST,"International & Global Studies",SPAN,202620,"4 hours"
202620INGS15958,"Environmental History",283,15958,A,4,"TR 0930-1045,  ","R Levine",TBA,26,26,"Closed // Waitlist: 1","General Education: G4: Exploring Past and Present<br><br>Reserved Seats: new first-year students - 10 (none available)","An introduction to the field of environmental history, which asks how the natural world has shaped the course of human civilization, and how humans, in turn, have shaped the natural world, over time.",HIST,"International & Global Studies",SPAN,202620,"4 hours"
202620INGS15950,"History of the Middle East II",297,15950,A,4,"MWF 1000-1050,  ","N Roberts",TBA,26,25,"Available: 1 Reserved // Waitlist: 2","General Education: G4: Exploring Past and Present<br><br>Reserved Seats: new first-year students - 10 (1 available)","This second offering in a two-course sequence addresses the modern Middle East, and emphasizes the region's place in global politics and the world economy.  Among the topics considered are European imperialism and local responses, nineteenth-century reform movements, the rise of the nation-state, the impact of Arab nationalism, the Arab-Israeli conflict, Islamic political movements, gender relations in the region, the importance of oil, the Iraq conflict, terrorism and the peace process.",HIST,"International & Global Studies",SPAN,202620,"4 hours"
202620INGS15960,"Colonial and Imperial Warfare in North America and Southern Africa",324,15960,A,4,"W 1400-1630,  ","R Levine",TBA,15,12,"Available: 3","Prerequisites: One course with attribute G4 including AP or IB credit","This seminar compares the warfare that accompanied colonial encounters in North America and southern Africa, from the first European contact through the early twentieth century.  It focuses on wars fought in response to resistance by native peoples and on the use of native allies in warfare between imperial foes as windows into the processes of acculturation, resistance, dispossession, and representation that characterized the colonial encounter as a whole.  Texts range from traditional military history to religious, cultural, environmental, and comparative approaches to the topic.",HIST,"International & Global Studies",SPAN,202620,"4 hours"
202620INGS15953,"Religious Nationalism in the Contemporary World",338,15953,A,4,"T 1330-1600,  ","N Roberts",TBA,15,15,"Closed // Waitlist: 0","Prerequisites: One course with attribute G4 including AP or IB credit","Religious nationalist parties and social movements play an increasingly important role in our contemporary world. Promising a more “authentic” approach to nationalism than secular nationalism, these movements provide meaning to millions of adherents, while also contributing to partisanship and conflict around the world. This class investigates the history of religious nationalism with a focus primarily on the history of Christian, Muslim, and Jewish nationalism in the 20th and 21st centuries. Case studies will be drawn from the history of Israel/Palestine, India/Pakistan, Ireland, and the United States.",HIST,"International & Global Studies",SPAN,202620,"4 hours"
202620INGS15956,"Sexuality and the Self in Modern Europe",378,15956,A,4,"TR 1500-1615,  ","A Mansker",TBA,15,15,"Closed // Waitlist: 0","Prerequisites: One course with attribute G4 including AP or IB credit","This seminar investigates how and why sexuality became the key to selfhood in modern Europe.  Drawing on the tools of gender analysis and cultural history, students explore the ways in which political, socioeconomic and cultural tensions of particular historical moments were manifested in the sexuality of individuals.  Students also examine a variety of primary sources from the eighteenth to twentieth centuries to consider how individuals defined themselves through sexuality and how definitions were imposed on them by a variety of institutions and authority figures.",HIST,"International & Global Studies",SPAN,202620,"4 hours"
202620INGS15957,"Capitalism in Britain and the United States",403,15957,A,4,"TR 0800-0915,  ","M Mitchell",TBA,15,13,"Available: 2","Prerequisites: One course with attribute G4 including AP or IB credit","The impulse to combine land, labor, and capital in profitable ways has always existed; this course focuses on how British and American entrepreneurs have attempted this challenge over the past 500 years of history. The differing cultural, institutional, and technological developments faced by entrepreneurs in each country are considered.",HIST,"International & Global Studies",SPAN,202620,"4 hours"
202620INGS15961,"The History of Sustainability and Sustainable Development",421,15961,A,4,"TR 1100-1215,  ","R Levine",TBA,15,14,"Available: 1","Prerequisites: One course with attribute G4 including AP or IB credit","An examination of the historical origins and development of the discourses of sustainability, sustainable development, and the green economy, which have been ubiquitous, influential, and critically and historiographically under-examined in contemporary U.S. and global society. The course draws on contemporary global environmental historiography, while analyzing key primary sources such as Malthus' <em>An Essay on the Principles of Population</em>, Marsh's <em>Man and Nature</em>, Ehrlich's <em>Population Bomb</em>, Club of Rome's <em>Limits to Growth</em>, the United Nations' Brundtland Commission's ""Our Common Future,"" the United Nations' Millennium Development Goals, and the University of the South's Sustainability Master Plan.",HIST,"International & Global Studies",SPAN,202620,"4 hours"
