id,title,num,crn,section,hours,times,faculty,location,limit,enrolled,available,info,description,subj,subject,subj_code,cat_term,credit_hours
202620MUSC15288,"Applied Voice",375,15288,A,2,"F 1400-1450,  ","K Ginger","St. Luke's Chapel",15,2,"Available: 13","Prerequisite:  MUSC 260 ; Applied Music Fee: $495","An advanced singing course that provides individual lessons on a weekly basis with daily practice expected. This course may be repeated more than once for credit.",MUSC,"Music, Ensembles and Lessons (Individual and Group)",MUSC,202620,"2 hours"
202620MUSC15690,"Applied Voice: Contemporary Vocal Styles",376,15690,A,2,"F 1400-1450,  ","K Ginger","St. Luke's Chapel",15,1,"Available: 14","Pre- or Corequisite:  MUSC 260 ; Applied Music Fee: $495","Focusing on musical theater and commercial vocal styles, this advanced singing course provides individual lessons on a weekly basis with daily practice expected. This course may be repeated more than once for credit.",MUSC,"Music, Ensembles and Lessons (Individual and Group)",MUSC,202620,"2 hours"
202620MUSC15290,"Applied Strings: Violin",377,15290,A,2,"TBA ,  ","S Miller",TBA,15,0,"Available: 15","Prerequisite:  MUSC 260 ; Applied Music Fee: $495","Weekly lessons with the instructor and daily practice are expected. This course may be repeated more than once for credit.",MUSC,"Music, Ensembles and Lessons (Individual and Group)",MUSC,202620,"2 hours"
202620MUSC15291,"Applied Strings: Cello/Bass",377,15291,B,2,"TBA ,  ","S Miller/ K Vest",TBA,15,0,"Available: 15","Prerequisite:  MUSC 260 ; Applied Music Fee: $495","Weekly lessons with the instructor and daily practice are expected. This course may be repeated more than once for credit.",MUSC,"Music, Ensembles and Lessons (Individual and Group)",MUSC,202620,"2 hours"
202620MUSC15824,"Applied Strings: Viola",377,15824,D,2,"TBA ,  ","M Torres Perdomo",TBA,15,1,"Available: 14","Pre- or Corequisite:  MUSC 260 ; Applied Music Fee: $495","Weekly lessons with the instructor and daily practice are expected. This course may be repeated more than once for credit.",MUSC,"Music, Ensembles and Lessons (Individual and Group)",MUSC,202620,"2 hours"
202620MUSC15836,"Applied Strings: Jazz Bass",377,15836,E,2,"TBA ,  ","S Miller/ C Kirchen",TBA,15,0,"Available: 15","Pre- or Corequisite:  MUSC 160 ; Applied Music Fee: $495","Weekly lessons with the instructor and daily practice are expected. This course may be repeated more than once for credit.",MUSC,"Music, Ensembles and Lessons (Individual and Group)",MUSC,202620,"2 hours"
202620MUSC15355,"Applied Winds: Oboe",379,15355,A,2,"TBA ,  ","S Miller/ R Van de Ven",TBA,15,0,"Available: 15","Prerequisite:  MUSC 260 ; Applied Music Fee: $495","Weekly lessons with the instructor and daily practice are expected. This course may be repeated more than once for credit.",MUSC,"Music, Ensembles and Lessons (Individual and Group)",MUSC,202620,"2 hours"
202620MUSC15470,"Applied Winds: Flute",379,15470,B,2,"TBA ,  ","S Miller/ J Ditzel",TBA,15,0,"Available: 15","Pre- or Corequisite:  MUSC 260 ; Applied Music Fee: $495","Weekly lessons with the instructor and daily practice are expected. This course may be repeated more than once for credit.",MUSC,"Music, Ensembles and Lessons (Individual and Group)",MUSC,202620,"2 hours"
202620MUSC15471,"Applied Winds: Trumpet",379,15471,C,2,"TBA ,  ","S Miller/ D Bethea",TBA,15,0,"Available: 15","Pre- or Corequisite:  MUSC 260 ; Applied Music Fee: $495","Weekly lessons with the instructor and daily practice are expected. This course may be repeated more than once for credit.",MUSC,"Music, Ensembles and Lessons (Individual and Group)",MUSC,202620,"2 hours"
202620MUSC15692,"Applied Winds: French Horn",379,15692,D,2,"TBA ,  ","S Miller/ G Danner",TBA,15,0,"Available: 15","Pre- or Corequisite:  MUSC 260 ; Applied Music Fee: $495","Weekly lessons with the instructor and daily practice are expected. This course may be repeated more than once for credit.",MUSC,"Music, Ensembles and Lessons (Individual and Group)",MUSC,202620,"2 hours"
202620MUSC15693,"Applied Winds: Saxophone",379,15693,E,2,"TBA ,  ","S Miller",TBA,15,0,"Available: 15","Pre- or Corequisite:  MUSC 260 ; Applied Music Fee: $495","Weekly lessons with the instructor and daily practice are expected. This course may be repeated more than once for credit.",MUSC,"Music, Ensembles and Lessons (Individual and Group)",MUSC,202620,"2 hours"
202620MUSC15694,"Applied Winds: Trombone",379,15694,F,2,"TBA ,  ","S Miller/ R Lamborn",TBA,15,0,"Available: 15","Pre- or Corequisite:  MUSC 260 ; Applied Music Fee: $495","Weekly lessons with the instructor and daily practice are expected. This course may be repeated more than once for credit.",MUSC,"Music, Ensembles and Lessons (Individual and Group)",MUSC,202620,"2 hours"
202620MUSC15695,"Applied Winds: Euphonium/Tuba",379,15695,G,2,"TBA ,  ","S Miller",TBA,15,0,"Available: 15","Pre- or Corequisite:  MUSC 260 ; Applied Music Fee: $495","Weekly lessons with the instructor and daily practice are expected. This course may be repeated more than once for credit.",MUSC,"Music, Ensembles and Lessons (Individual and Group)",MUSC,202620,"2 hours"
202620MUSC15696,"Applied Winds: Clarinet",379,15696,H,2,"TBA ,  ","S Miller",TBA,15,0,"Available: 15","Pre- or Corequisite:  MUSC 260 ; Applied Music Fee: $495","Weekly lessons with the instructor and daily practice are expected. This course may be repeated more than once for credit.",MUSC,"Music, Ensembles and Lessons (Individual and Group)",MUSC,202620,"2 hours"
202620MUSC15461,"Applied Percussion",385,15461,A,2,"TBA ,  ","S Miller/ C Nelsen",TBA,15,0,"Available: 15","Prerequisite:  MUSC 260 ; Applied Music Fee: $495","Weekly lessons with the instructor and daily practice are expected. Music majors may earn a full course credit during the semester in which a senior recital is given. This course may be repeated more than once for credit.",MUSC,"Music, Ensembles and Lessons (Individual and Group)",MUSC,202620,"2 hours"
202620MUSC15686,"Applied Percussion",385,15686,B,2,"TBA ,  ","S Miller/ N Felty",TBA,15,0,"Available: 15","Prerequisite:  MUSC 260 ; Applied Music Fee: $495","Weekly lessons with the instructor and daily practice are expected. Music majors may earn a full course credit during the semester in which a senior recital is given. This course may be repeated more than once for credit.",MUSC,"Music, Ensembles and Lessons (Individual and Group)",MUSC,202620,"2 hours"
202620MUSC15688,"Applied Harp",387,15688,A,2,"TBA ,  ","S Miller/ S Crocker",TBA,15,0,"Available: 15","Prerequisite:  MUSC 260 ; Applied Music Fee: $495","Weekly lessons with the instructor and daily practice are expected. Music majors may earn a full course credit during the semester in which a senior recital is given. This course may be repeated more than once for credit.",MUSC,"Music, Ensembles and Lessons (Individual and Group)",MUSC,202620,"2 hours"
202620MUSC15452,"Applied Jazz Piano",389,15452,A,2,"TBA ,  ","K Wright",TBA,15,0,"Available: 15","Prerequisite:  MUSC 260 ; Pre- or Corequisite:  MUSC 257 ; Applied Music Fee: $495",,MUSC,"Music, Ensembles and Lessons (Individual and Group)",MUSC,202620,"2 hours"
202620MUSC15418,Recital,470,15418,A,2,"TBA ,  ","S Miller",TBA,10,0,"Available: 10","Open only to students pursuing majors in music; Prerequisite:  MUSC 370 ",,MUSC,"Music, Ensembles and Lessons (Individual and Group)",MUSC,202620,"2 hours"
202620NEUR16175,"Introduction to Neuroscience",101,16175,A,4,"MWF 1100-1150,  ","B Choudhary",TBA,26,26,"Closed // Waitlist: 3","General Education: G5: Observing-Experimenting-Modeling","This course provides an introduction to the structure and function of the central and peripheral nervous systems. Fundamental concepts and topics in neuroscience will be discussed using molecular/cellular, behavioral and/or cognitive frameworks; clinically relevant conditions (e.g., neurodegenerative diseases, psychiatric disorders) will also be explored. Methods and techniques used by neuroscientists in research laboratories and clinical settings will be used to understand how neuroscience knowledge is constructed.",NEUR,Neuroscience,NEUR,202620,"4 hours"
202620NEUR16176,"Behavioral and Cognitive Neuroscience",220,16176,A,4,"MWF 0900-0950,  ","T Reppert",TBA,26,26,"Closed // Waitlist: 2","Prerequisite:  NEUR 101 ","This course explores the neural mechanisms underlying behavior and cognition. Topics may include motivation, learning and memory, emotion, stress, sleep and circadian rhythms, attention, and decision-making. Neuroscience methodology and preclinical models of psychiatric and neurodegenerative disorders will be discussed.",NEUR,Neuroscience,NEUR,202620,"4 hours"
202620NEUR16087,"Experimental Neurobiology (Lab)",351,16087,A,4,"TR 0930-1045,  ","C Shelley",TBA,16,8,"Available: 8","General Education: GMWI: Major Writing Intensive<br><br>Lab Science; Prerequisite:  NEUR 208 ","This lecture and laboratory course utilizes electrical recordings from a variety of invertebrates to build upon topics discussed in NEUR 208, illustrating the principles of nervous system communication in sensory and motor systems. The course will also include the roles of hypothesis testing, models, data analysis, and the scientific method in understanding how experimental data can lead to knowledge of nervous system function.",NEUR,Neuroscience,NEUR,202620,"4 hours"
202620NEUR16088,"Experimental Neurobiology (Lab)",351,16088,L1,0,"R 1330-1630,  ","C Shelley",TBA,16,8,"Available: 8","Prerequisite:  NEUR 208 ","This lecture and laboratory course utilizes electrical recordings from a variety of invertebrates to build upon topics discussed in NEUR 208, illustrating the principles of nervous system communication in sensory and motor systems. The course will also include the roles of hypothesis testing, models, data analysis, and the scientific method in understanding how experimental data can lead to knowledge of nervous system function.",NEUR,Neuroscience,NEUR,202620,"0 hours"
202620NEUR16281,"Seminars in Molecular & Cellular Neuroscience",399,16281,A,4,"TR 1100-1215,  ","B Choudhary",TBA,16,16,"Closed // Waitlist: 4",,"A seminar on a topic related to neuroscience. This course may be repeated for credit when the topic differs.",NEUR,Neuroscience,NEUR,202620,"4 hours"
202620PHIL15846,Happiness,101,15846,A,4,"MWF 0900-0950,  ","A Moser",TBA,15,15,"Closed // Waitlist: 5","General Education: G3: Seeking Meaning,GFWI: Foundational Writing Intensive<br><br>Reserved Seats: new first-year students - 7 (none available)","Topics and themes in philosophy related to central questions of philosophy: Is there a meaning to human life? What can we know? What is the nature of reality? And how should we live? These questions are addressed through a rigorous examination of philosophical texts, works of literature, films, and contemporary issues.",PHIL,Philosophy,PHIL,202620,"4 hours"
202620PHIL15864,"Topics in Philosophy",101,15864,B,4,"MWF 1000-1050,  ","D Burnfin",TBA,15,15,"Closed // Waitlist: 4","General Education: G3: Seeking Meaning,GFWI: Foundational Writing Intensive<br><br>Reserved Seats: new first-year students - 7 (none available)","Topics and themes in philosophy related to central questions of philosophy: Is there a meaning to human life? What can we know? What is the nature of reality? And how should we live? These questions are addressed through a rigorous examination of philosophical texts, works of literature, films, and contemporary issues.",PHIL,Philosophy,PHIL,202620,"4 hours"
202620PHIL15868,"Topics in Philosophy",101,15868,C,4,"MWF 1100-1150,  ","D Burnfin",TBA,15,15,"Closed // Waitlist: 2","General Education: G3: Seeking Meaning,GFWI: Foundational Writing Intensive<br><br>Reserved Seats: new first-year students - 7 (none available)","Topics and themes in philosophy related to central questions of philosophy: Is there a meaning to human life? What can we know? What is the nature of reality? And how should we live? These questions are addressed through a rigorous examination of philosophical texts, works of literature, films, and contemporary issues.",PHIL,Philosophy,PHIL,202620,"4 hours"
202620PHIL15853,"Freedom, Justice, and Commerce",205,15853,A,4,"MWF 1300-1350,  ","A Moser",TBA,26,26,"Closed // Waitlist: 7","General Education: G3: Seeking Meaning","An examination, through classical and contemporary texts, of the ways in which our economic actions and interests are shaped by our political values and institutions, and also by more general considerations of justice and fairness.  Special attention is given to the following questions: Do the political values cherished most highly presuppose a market economy? Or would they be better served by a socialist economy?  Can a market economy flourish in the absence of these values?  Which sort of economic structure is most conducive to the common good?  Can a just society tolerate economic inequality?",PHIL,Philosophy,PHIL,202620,"4 hours"
202620PHIL15857,"The Self",220,15857,A,4,"TR 1100-1215,  ","A Averitt",TBA,26,26,"Closed // Waitlist: 0","General Education: G3: Seeking Meaning<br><br>Reserved Seats: new first-year students - 10 (none available)","An analysis of the major turning points in the development of the concept of the self in Western philosophical thought. The point of the analysis is to elucidate our contemporary conception and the problems with it in order to point to a solution to these problems. In so doing, possible answers to the questions of the nature of rationality, knowledge, faith, and the meaning of life will be proposed.",PHIL,Philosophy,PHIL,202620,"4 hours"
202620PHIL16289,"Environmental Ethics",230,16289,A,4,"MW 1400-1515,  ","J Peters",TBA,26,26,"Closed // Waitlist: 10","General Education: G3: Seeking Meaning<br><br>Reserved Seats: new first-year students - 12 (none available)","Examines a wide range of controversial issues concerning the moral responsibilities of human beings toward the natural environment with special attention to competing philosophical theories on the moral status of non-human species and natural ecosystems.",PHIL,Philosophy,PHIL,202620,"4 hours"
202620PHIL16128,"Business Ethics",232,16128,A,4,"TR 0800-0915,  ","A Averitt",TBA,26,26,"Closed // Waitlist: 7","General Education: G3: Seeking Meaning","An examination of the moral dimensions of business activity, especially within the context of a democratic society. Topics may include social and economic justice, the nature of corporations, corporate accountability, social responsibility, the morality of hiring and firing, employee rights and duties, advertising, product safety, obligations to the environment, and international business.",PHIL,Philosophy,PHIL,202620,"4 hours"
202620PHIL15861,"Philosophy of Religion",251,15861,A,4,"MW 1400-1515,  ","A Averitt",TBA,18,17,"Available: 1 Reserved // Waitlist: 1","General Education: G3: Seeking Meaning<br><br>Reserved Seats: new first-year students - 7 (1 available)","An examination of philosophical problems and issues which commonly attend western religious belief and practice. Major topics of inquiry include the theistic conception of God, classical and contemporary arguments for and against the existence of God, the epistemic significance of religious experience, the relationship between faith and reason, and the extent to which religious belief is undermined by the findings of modern science.",PHIL,Philosophy,PHIL,202620,"4 hours"
202620PHIL15837,"Modern Philosophy: Metaphysics and Epistemology",304,15837,A,4,"MW 1530-1645,  ","C Conn",TBA,18,12,"Available: 6","Prerequisites: One course in philosophy at the 100- or 200-level","An examination of the philosophical revolution that accompanied the rise of modern science and its distinctive set of philosophical problems.  The following problems will be emphasized: the nature of knowledge and perception, the existence and nature of God, the existence of the material world, the nature of linguistic meaning, the mind-body relationship, and the nature of personal identity.  Not open for credit to students who have already received credit for PHIL 204.",PHIL,Philosophy,PHIL,202620,"4 hours"
202620PHIL15841,Metaphysics,308,15841,A,4,"TR 1500-1615,  ","J Peters",TBA,18,10,"Available: 8","Open only to students pursuing majors in philosophy; Prerequisites: One course in philosophy numbered 200 or above","This historically oriented program of reading and discussion focuses on the basic issues and fundamental problems of metaphysics. Particular attention is paid to the place of metaphysics in traditional philosophical thought and to its contemporary status and significance.",PHIL,Philosophy,PHIL,202620,"4 hours"
202620PHIL15840,"Modern Logic",312,15840,A,4,"MWF 1100-1150,  ","C Conn",TBA,18,17,"Available: 1","General Education: G5Q: Observing-Experimenting-Modeling (Quantitative/Algorithmic/Abstract Logical Reasoning)<br><br>Reserved Seats: new first-year students - 5 (none available)","The aim of this course is to provide students with a working knowledge of modern logic through an examination of three increasingly powerful methods of representing the logical structure of ordinary language arguments.  Emphasis on developing strategies for proving validity and invalidity.",PHIL,Philosophy,PHIL,202620,"4 hours"
202620PHIL15855,Nietzsche,415,15855,A,4,"TR 1330-1445,  ","A Moser",TBA,16,16,"Closed // Waitlist: 1","Prerequisites: One course in philosophy at the 100- or 200-level","Examines selected writings from <em>The Birth of Tragedy</em> to <em>The Will to Power</em>. Emphasis is given to close reading of texts and critical evaluation of their main ideas.",PHIL,Philosophy,PHIL,202620,"4 hours"
202620PHIL15870,"Philosophy of Economics",426,15870,A,4,"TR 0930-1045,  ","D Burnfin",TBA,18,8,"Available: 10","Prerequisites: One course in philosophy at the 100- or 200-level","An examination of contemporary debate on a selected topic such as ethical relativism, the relation of mind to body, or the nature of free will.",PHIL,Philosophy,PHIL,202620,"4 hours"
202620PHED16290,"Beginning Fencing",106,16290,A,0,"TR 1930-2020,  ","B Engel",TBA,12,10,"Available: 2",,,PHED,"Physical Education",PHED,202620,"0 hours"
202620PHED16291,"Weight Training",119,16291,A,0,"TR 1100-1150,  ","T Vander Jeugdt",TBA,20,20,Closed,,,PHED,"Physical Education",PHED,202620,"0 hours"
202620PHED16292,"Lifetime of Fitness: Running",125,16292,A,0,"MW 1000-1050,  ","G Cathell",TBA,20,14,"Available: 6",,,PHED,"Physical Education",PHED,202620,"0 hours"
202620PHED16293,"Lifetime of Fitness: Swimming",126,16293,A,0,"TR 1100-1200,  ","M Fino",TBA,20,18,"Available: 2",,,PHED,"Physical Education",PHED,202620,"0 hours"
202620PHED16294,"Lifetime of Fitness: Mountain Biking",128,16294,A,0,"W 1300-1430,  ","B Austin",TBA,8,8,Closed,,,PHED,"Physical Education",PHED,202620,"0 hours"
202620PHED16310,"Lifetime of Fitness: Speed and Agility",136,16310,A,0,"MW 1000-1050,  ",Staff,TBA,20,7,"Available: 13",,,PHED,"Physical Education",PHED,202620,"0 hours"
202620PHED16295,"Lifetime of Fitness: Change-Bell Ringing",138,16295,A,0,"MF 0900-0950,  ","R Gotko",TBA,6,5,"Available: 1",,"English Change Ringing is a non-competitive and non-contact team activity performed on the ring of eight bells in Breslin Tower. The ""exercise,"" as it is commonly known, is highly stimulating intellectually and mildly demanding physically. It develops mental and physical skills in the context of a communal effort. A successful student will acquire the bells handling skills necessary to begin ringing the changes.",PHED,"Physical Education",PHED,202620,"0 hours"
202620PHED16296,"Advanced English Change Ringing",139,16296,A,0,"TBA ,  ","M Keen",TBA,8,3,"Available: 5","Prerequisite:  PHED 138 ","Skill development to ring common English change ringing methods such as hunting, Plain Bob, Grandsire, Steadman, etc.",PHED,"Physical Education",PHED,202620,"0 hours"
202620PHED16337,"Stretch and Relax",170,16337,A,0,"TR 0800-0850,  ","L Khaleel",TBA,20,10,"Available: 10",,,PHED,"Physical Education",PHED,202620,"0 hours"
202620PHED16338,"Introduction to Hatha Yoga",171,16338,A,0,"MW 0800-0850,  ","L Khaleel",TBA,20,0,"Available: 20","Physical Education Fee: $175",,PHED,"Physical Education",PHED,202620,"0 hours"
202620PHED16297,Pilates,172,16297,A,0,"TR 0800-0850,  ","K Butters",TBA,15,15,Closed,"Physical Education Fee: $175","The pilates exercise program creates length, strength, and flexibility in the muscles.  It promotes body balance and helps to provide spinal support.  The program also uses mental focus to improve efficiency of movement while encouraging the control of muscles.",PHED,"Physical Education",PHED,202620,"0 hours"
202620PHED16320,Pickleball,176,16320,A,0,"MW 0900-0950,  ","T Pacella",TBA,22,21,"Available: 1",,"For both beginners and advanced players. No equipment is necessary for the students in order to be a part of this course. Court shoes are required.",PHED,"Physical Education",PHED,202620,"0 hours"
202620PHED16298,"Sport Aviation",180,16298,A,0,"M 1900-2200,  ","C Cavagnaro/ C Reynolds",TBA,10,10,Closed,"Aviation Fee: $2150","This course teaches the ground school requirements for the private pilot's license and provides instruction of basic flying skills.",PHED,"Physical Education",PHED,202620,"0 hours"
202620PHED16300,"Martial Arts",200,16300,A,0,"MW 1100-1150,  ","S Bates",TBA,16,13,"Available: 3",,,PHED,"Physical Education",PHED,202620,"0 hours"
202620PHED16301,"Lifetime of Wellness: Reducing Stress through Meditation and Movement",231,16301,A,0,"W 1430-1600,  ","L Collins",TBA,10,10,Closed,,"Through methods of systematic cultivation of awareness of body and mind such as stretching, yoga, body-scan, attention to breathing, sitting and walking meditation, and loving-kindness meditation, this course encourages greater health and well-being. The promotion of greater awareness reduces anxiety, anger, and depression while enhancing psychological resilience, the ability to act effectively under increased short and long-term stress, and energy and enthusiasm for life. Taught in a compressed seven-week format, this course requires daily practice outside of class and student participation in one four-hour weekend class meeting.",PHED,"Physical Education",PHED,202620,"0 hours"
202620PHED15303,"Alpine Mountaineering Traverse in Colorado",262,15303,A,0,"TBA ,  ","J Benson",TBA,10,9,"Available: 1","Prerequisites: Only open to students admitted to this Outing Program","A ten-day Sewanee Outdoor Program winter alpine expedition in Colorado, for which three days are devoted to acclimating hikes in the San Juan mountains;  seven days are spent snowshoeing, backpacking, and camping on a thirty-five mile traverse on the continental divide.  Requires pre-trip preparation, special instruction, weekly training runs and hikes, and additional fee.",PHED,"Physical Education",PHED,202620,"0 hours"
202620PHED15304,"Marathon and Half-Marathon Runs",263,15304,A,0,"TBA ,  ","J Benson",TBA,99,55,"Available: 44",,"The Sewanee Outing Program gives instruction and facilitates twelve weeks of required training runs in preparation for either Sewanee's <em>Rocks & Roots</em> trail run (22 or 13.1 miles) or Nashville’s <em>Music City Marathon</em> (26.2 or 13.1 miles).",PHED,"Physical Education",PHED,202620,"0 hours"
202620PHED15351,"Canoeing the Rio Grande",264,15351,A,0,"TBA ,  ","J Benson",TBA,99,0,"Available: 99","Prerequisites: Only open to students admitted to this Outing Program","This seven-day Sewanee Outdoor Program expedition, in preparation for which weekly training and paddling sessions are required, involves canoeing and camping through eighty-three miles of Lower Canyons in a true wilderness setting along the Mexico-Texas border.",PHED,"Physical Education",PHED,202620,"0 hours"
202620PHED16302,"T'ai Chi",270,16302,A,0,"TR 1930-2030,  ","S Bates",TBA,16,13,"Available: 3","Physical Education Fee: $175",,PHED,"Physical Education",PHED,202620,"0 hours"
202620PHED15825,"Water Polo",303,15825,A,0,"R 1930-2030,  ","R Macdonald",TBA,20,20,Closed,,"This course emphasizes fundamental water polo skills (egg-­beater, passing, catching, and shooting), as well as the development of game awareness through an exploration of offensive and defensive strategies for set play, counterattack, and man-up/man‐down situations.",PHED,"Physical Education",PHED,202620,"0 hours"
202620PHED16303,"Advanced Fencing",306,16303,A,0,"TR 2030-2120,  ","B Engel",TBA,16,15,"Available: 1","Prerequisite:  PHED 106 ",,PHED,"Physical Education",PHED,202620,"0 hours"
202620PHYS16228,"General Physics II (Lab)",102,16228,A,4,"TR 0930-1045,  ","S Hancock",TBA,60,44,"Available: 16","General Education: G5E: Observing-Experimenting-Modeling (Experimental/Experiential)<br><br>Lab Science; Prerequisite:  PHYS 101 ","This broad study of classical and modern physics includes all major fields. The mathematical description utilizes geometry, trigonometry, algebra and calculus. Lectures: three hours; laboratory, three hours.",PHYS,"Physics and Astronomy",PHYS,202620,"4 hours"
202620PHYS16229,"General Physics II (Lab)",102,16229,L1,0,"M 1300-1630,  ","S Hancock",TBA,20,20,"Closed // Waitlist: 0","Prerequisite:  PHYS 101 ","This broad study of classical and modern physics includes all major fields. The mathematical description utilizes geometry, trigonometry, algebra and calculus. Lectures: three hours; laboratory, three hours.",PHYS,"Physics and Astronomy",PHYS,202620,"0 hours"
202620PHYS16230,"General Physics II (Lab)",102,16230,L2,0,"R 1330-1700,  ","S Hancock",TBA,20,20,"Closed // Waitlist: 3","Prerequisite:  PHYS 101 ","This broad study of classical and modern physics includes all major fields. The mathematical description utilizes geometry, trigonometry, algebra and calculus. Lectures: three hours; laboratory, three hours.",PHYS,"Physics and Astronomy",PHYS,202620,"0 hours"
